{
  "product_id": "churchcore-chms",
  "repo_name": "ChurchCore-Business",
  "version": "0.1.0",
  "report_timestamp": "2026-10-17T21:48:37.645780+00:00",
  "online_status": {
    "is_online": false,
    "vercel_status": "pending",
    "vercel_url": "",
    "supabase_status": "local_only",
    "readiness_assessment": {
      "readiness_score_pct": 75,
      "blockers": [],
      "next_required_actions": [
        "Deploy production build on Vercel",
        "Verify Supabase production keys"
      ]
    }
  },
  "mvp_status": {
    "phase": "beta",
    "completion_pct": 80,
    "latest_milestones": [
      "Core schema and UI foundation completed"
    ]
  },
  "latest_changes": [
    "fix(marketing): resolve screenshot relative paths for live slide player and update telemetry (1119bac)",
    "feat(marketing): launch dynamic Marketing & Business Presos Hub with interactive decks and AI prompt packs (f17127e)",
    "sec(governance): sequester confidential financial models and battlecards to private ChurchCore-Vault (b96b43f)",
    "fix(governance): add multi-tier manifest discovery with authenticated gh api and token fallback (5751a7a)",
    "docs: overhaul root README and ARCHITECTURE with visual galleries, Mermaid diagrams, and live fleet matrix (6c62168)"
  ],
  "next_steps": [
    "Execute automated test suite",
    "Verify production deployment"
  ],
  "ai_session_telemetry": {
    "last_model": "gemini-2.5-pro",
    "session_duration_minutes": 30,
    "session_date": "2026-10-17T21:48:37.645780+00:00",
    "session_operator": "Ricardo Julia",
    "summary_of_work": "Automated Council Directives Enforcement"
  },
  "deployment_diagnostics": {
    "recent_errors": [],
    "mitigations_applied": []
  },
  "governance_compliance": {
    "council_decisions_acknowledged": [
      "COUNCIL-2026-001",
      "COUNCIL-2026-002",
      "COUNCIL-2026-003",
      "COUNCIL-2026-004"
    ],
    "brand_house_compliant": true,
    "sovereign_db_isolation_verified": true
  }
}